{
  "$schema": "http://json-schema.org/draft-07/schema#",
  "$id": "https://bearing.dev/schemas/config-1.json",
  "title": "BEARING workspace configuration",
  "description": "Configuration for the BEARING decision system. Lives at .bearing/config.json in the workspace root -- not inside the decisions directory, because config must be resolvable before the decisions path is known.",
  "type": "object",
  "additionalProperties": false,
  "required": ["version"],
  "properties": {
    "$schema": { "type": "string" },
    "version": {
      "const": 1,
      "description": "Config format version. Bumped only on a breaking change to this schema."
    },

    "decisions": {
      "type": "object",
      "additionalProperties": false,
      "description": "REPO FACT. Where this repository's decision records live.",
      "properties": {
        "path": {
          "type": "string",
          "description": "Path to the authored decision records, relative to the workspace root. Every other path derives from this one; nothing hardcodes 'docs/decisions'.",
          "examples": ["docs/decisions", "docs/adr", "docs/ADRs"]
        },
        "shadow_dir": {
          "type": "string",
          "description": "Name of the shadow-graph subdirectory inside decisions.path. Candidates are never interleaved with authored records."
        },
        "index_file": {
          "type": "string",
          "description": "Name of the generated progressive-disclosure index inside decisions.path."
        },
        "transcripts_dir": {
          "type": "string",
          "description": "Name of the interview-transcript subdirectory inside the shadow directory. Transcripts are evidence, so they inherit the shadow graph's non-authoritative standing."
        }
      }
    },

    "scope": {
      "type": "object",
      "additionalProperties": false,
      "description": "REPO FACT. Default corpus bounds for recovery passes.",
      "properties": {
        "include": {
          "type": "array",
          "items": { "type": "string" },
          "description": "Glob patterns defining the recovery scope. An empty list means no default scope -- recovery must be given one explicitly, which is deliberate: unscoped recovery on a zero-anchor repository produces an unreviewable first batch."
        },
        "exclude": { "type": "array", "items": { "type": "string" } }
      }
    },

    "profile": {
      "enum": ["pilot", "thorough", "audit"],
      "description": "REPO FACT. Onboarding profile. 'pilot' proves the loop closes on a small scope; 'thorough' pursues coverage in reviewed waves; 'audit' measures without promoting anything."
    },

    "skills": {
      "type": "object",
      "additionalProperties": false,
      "description": "REPO FACT. Where the BEARING Skills are resolved from.",
      "properties": {
        "source": {
          "enum": ["plugin", "vendored"],
          "description": "'plugin' resolves from the installed plugin. 'vendored' resolves from an in-repo .agents/skills/ copy, which takes discovery precedence in both Cursor and Codex and therefore shadows the installed plugin -- recorded here so that shadowing is explicit rather than accidental."
        },
        "vendored_version": {
          "type": ["string", "null"],
          "description": "The BEARING version that was vendored, pinned so a candidate's provenance stays reconstructible. Set by 'bearing vendor'; null when source is 'plugin'."
        }
      }
    },

    "projections": {
      "type": "object",
      "additionalProperties": false,
      "description": "Which canonical sources get projected into which runtime-native formats, and where the output lands.",
      "properties": {
        "subagents": { "$ref": "#/$defs/projection" },
        "rules": { "$ref": "#/$defs/projection" },
        "contracts": { "$ref": "#/$defs/projection" }
      }
    },

    "models": {
      "type": "object",
      "additionalProperties": false,
      "description": "OPERATOR FACT. Model assignment per pipeline role. Free to choose, but the Model Tiering Contract is enforced: the extract role must resolve to a model the price book marks 'cheap'.",
      "properties": {
        "extract": { "$ref": "#/$defs/modelRole" },
        "resolve": { "$ref": "#/$defs/modelRole" },
        "score": { "$ref": "#/$defs/modelRole" },
        "interview": { "$ref": "#/$defs/modelRole" }
      }
    },

    "cost": {
      "type": "object",
      "additionalProperties": false,
      "properties": {
        "reviewer_rate_usd_per_hour": {
          "type": ["number", "null"],
          "minimum": 0,
          "description": "OPERATOR FACT. Deliberately null by default. While null, BEARING reports review cost in minutes and never converts it to dollars -- a fabricated dollar figure for engineer time is worse than an honest count of minutes."
        },
        "price_book_max_age_days": {
          "type": "integer",
          "minimum": 1,
          "description": "OPERATOR FACT. Beyond this age the price book is reported as stale in every cost figure it produces."
        },
        "token_estimate_uncertainty": {
          "type": "number",
          "minimum": 0,
          "maximum": 1,
          "description": "OPERATOR FACT. Fractional uncertainty applied to estimated (not measured) token counts to produce the low/high bounds of a cost range."
        },
        "budget_usd_per_run": {
          "type": ["number", "null"],
          "minimum": 0,
          "description": "REPO FACT. Hard per-run model-cost cap. A run that reaches it stops and reports partial results."
        }
      }
    },

    "interview": {
      "type": "object",
      "additionalProperties": false,
      "properties": {
        "transcripts": {
          "type": "object",
          "additionalProperties": false,
          "properties": {
            "retention": {
              "enum": ["committed", "local", "none"],
              "description": "REPO FACT. 'committed' keeps transcripts in git as audit evidence. 'local' writes them to a gitignored subdirectory for orgs that will not commit a named person's testimony. 'none' discards the transcript once the candidate is written."
            }
          }
        }
      }
    },

    "review": {
      "type": "object",
      "additionalProperties": false,
      "description": "REPO FACT. Review capacity, which bounds how many candidates may be surfaced at once.",
      "properties": {
        "budget_minutes_per_session": { "type": "integer", "minimum": 1 },
        "wave_size": {
          "type": "integer",
          "minimum": 1,
          "description": "Maximum candidates surfaced per wave. Each wave is fully reviewed before the next is generated, which preserves reviewability without capping total coverage."
        },
        "seconds_per_candidate_estimate": { "type": "integer", "minimum": 1 }
      }
    },

    "enforcement": {
      "type": "object",
      "additionalProperties": false,
      "properties": {
        "block_on": {
          "type": "array",
          "description": "REPO FACT. Which mechanisms may block a merge. 'recovery_signal' is deliberately not an accepted value: a confidence score is a statement about evidence, never a statement of organizational authority.",
          "items": { "enum": ["structural", "known_contract"] }
        }
      }
    },

    "verify": {
      "type": "object",
      "additionalProperties": false,
      "description": "REPO FACT. Thresholds for the mandate conformance suite run by 'bearing verify'.",
      "properties": {
        "escalation_recall_min": { "type": "number", "minimum": 0, "maximum": 1 },
        "false_escalation_rate_max": {
          "type": "number",
          "minimum": 0,
          "maximum": 1,
          "description": "Over-escalation is also a failure: an agent that stops on everything is unusable, so ESCALATE is scored on both recall and false-positive rate."
        },
        "anchor_coverage_min": {
          "type": "number",
          "minimum": 0,
          "maximum": 1,
          "description": "Measured within the declared scope only. Repository-wide anchor coverage is a vanity metric on a legacy codebase."
        },
        "index_token_budget": {
          "type": "integer",
          "minimum": 1,
          "description": "Ceiling on the always-loaded disclosure index. An index that grows without bound silently reverses the framework's value."
        },
        "proposed_stale_days": { "type": "integer", "minimum": 1 },
        "time_to_first_value_minutes": {
          "type": "integer",
          "minimum": 1,
          "description": "The promise QUICKSTART.md makes, held as a measured criterion rather than a claim."
        },
        "negative_set_hallucination_rate_max": { "type": "number", "minimum": 0, "maximum": 1 },
        "cost_per_promoted_trailing_window": { "type": "integer", "minimum": 2 }
      }
    }
  },

  "$defs": {
    "projection": {
      "type": "object",
      "additionalProperties": false,
      "properties": {
        "targets": {
          "type": "array",
          "description": "REPO FACT. Runtime formats to generate. Removing a target is honored, and recorded as a deliberate skip in .bearing/projections.lock.json so a later reader does not have to guess why the output is absent.",
          "items": { "enum": ["cursor", "claude", "codex", "agents-md", "copilot", "lint", "ci"] }
        },
        "scope": {
          "enum": ["repo", "user", "ephemeral"],
          "description": "OPERATOR FACT. 'repo' commits adapters into the workspace so anyone cloning gets them. 'user' writes to the home directory, for machinery identical across repos or for repos you do not own. 'ephemeral' renders to a temp directory at session start and commits nothing."
        }
      }
    },
    "modelRole": {
      "type": "object",
      "additionalProperties": false,
      "properties": {
        "tier": { "enum": ["cheap", "mid", "frontier"] },
        "model": {
          "type": "string",
          "description": "A price-book model id, or 'inherit' to use whatever model the host agent is already running."
        }
      }
    }
  }
}
